{
  "head_message": {
    "text": "10월 재료교체 과제는 Normal Line 수평전개를 완료해 누적 26대에 적용했으며, 북미는 PLC 검증 후 10/13 적용하겠습니다",
    "source_ids": [
      "D-260930-khw-01",
      "D-261001-ljh-01"
    ]
  },
  "project_comments": [
    {
      "project_id": "P-ASM-001",
      "text": "Normal Line 수평전개 完(9/30), 누적 26대",
      "source_ids": [
        "D-260930-khw-01"
      ]
    }
  ],
  "highlights": [
    {
      "text": "[재료교체] ESWA E77 0.171% → 0.139%(2주 평균), 효과 유지 확인",
      "source_ids": [
        "D-260928-ljh-01"
      ]
    },
    {
      "text": "[재료교체] Normal Line 수평전개 完 (WA 4대·MI_HL 2대), 누적 26대",
      "source_ids": [
        "D-260929-khw-01",
        "D-260930-khw-01"
      ]
    }
  ],
  "risks": [
    {
      "text": "[재료교체] 북미 PLC 펌웨어 상이 → 보정 파라미터 이식 전 검증 필요",
      "source_ids": [
        "D-261001-ljh-01"
      ]
    }
  ],
  "requests": [
    {
      "text": "북미 PLC 검증용 원격 접속 지원 여부 확인",
      "due": null,
      "dept": "IT팀",
      "source_ids": [
        "D-261001-ljh-01"
      ]
    }
  ]
}
