{
  "head_message": {
    "text": "9월 6개 과제는 투자 심의·대시보드 개발을 완료했고 ESWA 불량률 0.171% → 0.144%로 개선했으나, 수평전개 2건은 9/30로 지연되어 완료를 관리하겠습니다",
    "source_ids": [
      "D-260922-tester-03",
      "D-260922-tester-04",
      "D-260922-ljh-01",
      "D-260922-tester-02"
    ]
  },
  "project_comments": [
    {
      "project_id": "P-ASM-001",
      "text": "ESWA 0.171% → 0.144%(4일), Normal Line 전개 중",
      "source_ids": [
        "D-260922-ljh-01"
      ]
    },
    {
      "project_id": "P-APC-101",
      "text": "불량률 0.180% → 0.150% 확인",
      "source_ids": [
        "D-260922-tester-01"
      ]
    },
    {
      "project_id": "P-ROL-102",
      "text": "WA 적용 일정 9/25 → 9/30 변경",
      "source_ids": [
        "D-260922-tester-02"
      ]
    },
    {
      "project_id": "P-INV-103",
      "text": "투자 심의 完(9/22)",
      "source_ids": [
        "D-260922-tester-03"
      ]
    },
    {
      "project_id": "P-SYS-104",
      "text": "대시보드 개발 完(9/22)",
      "source_ids": [
        "D-260922-tester-04"
      ]
    },
    {
      "project_id": "P-DAT-105",
      "text": "수율 95.0% → 96.0% 확인",
      "source_ids": [
        "D-260922-tester-05"
      ]
    }
  ],
  "highlights": [
    {
      "text": "[재료교체] ESWA 0.171% → 0.144%, 2차 대표 4대 0.270% → 0.185%",
      "source_ids": [
        "D-260922-ljh-01",
        "P-ASM-001"
      ]
    },
    {
      "text": "[재료교체] MEB 전 라인·ESMI1 #2-2·3 수평전개 完(9/16)",
      "source_ids": [
        "P-ASM-001"
      ]
    },
    {
      "text": "[자동보정] 불량률 0.180% → 0.150%, [수율] 95.0% → 96.0%",
      "source_ids": [
        "D-260922-tester-01",
        "D-260922-tester-05"
      ]
    },
    {
      "text": "[설비 투자] 투자 심의 完, [대시보드] 개발 完 (9/22)",
      "source_ids": [
        "D-260922-tester-03",
        "D-260922-tester-04"
      ]
    }
  ],
  "risks": [
    {
      "text": "[재료교체] 효과가 4일 단기 수치 → 장기 모니터링으로 재확인 필요",
      "source_ids": [
        "D-260922-ljh-01"
      ]
    },
    {
      "text": "[검증 로직] WA 적용 9/25 → 9/30 지연 → 9/30 완료 여부 확인 필요",
      "source_ids": [
        "D-260922-tester-02"
      ]
    }
  ],
  "requests": []
}
